{
  "id": "plex",
  "name": "Plex",
  "cat": "Streaming Services",
  "description": "Library view with gold sidebar and landscape tiles",
  "accent": "#e5a00d",
  "nav_style": "sidebar",
  "hero_style": "landscape-hero",
  "grid_style": "tile-grid",
  "tier_required": "any",
  "best_for": ["movies", "series", "live"],
  "tizen_safe": true,
  "mom_friendly": false,
  "dave_power": false
}
