{
  "id": "netflix",
  "name": "Netflix",
  "cat": "Streaming Services",
  "description": "Cinematic dark hero with horizontal card rows",
  "accent": "#e50914",
  "nav_style": "top-nav",
  "hero_style": "cinematic-hero",
  "grid_style": "card-rows",
  "tier_required": "any",
  "best_for": ["movies", "series"],
  "tizen_safe": true,
  "mom_friendly": false,
  "dave_power": false
}
