{
  "id": "samsung-tizen",
  "name": "Samsung Tizen",
  "cat": "Smart TV Shells",
  "description": "Samsung Smart TV native shell with focus-ring style",
  "accent": "#1428a0",
  "nav_style": "top-nav",
  "hero_style": "landscape-hero",
  "grid_style": "landscape-grid",
  "tier_required": "any",
  "best_for": ["live", "movies", "series"],
  "tizen_safe": true,
  "mom_friendly": false,
  "dave_power": false
}
